Timestamp,Unnamed: 1,Unnamed: 2,Year in School:,Expected Graduation Date (Month and Year):,Major:,Minor (if applicable),"Have you ever applied to Scope before? If so, which semester(s)?",Are you willing to commit at least 4 hours a week to the club (including general meetings and weekly project team meetings)?,Do you have any conflicts on Tuesdays from 6-7 pm?,Do you plan to be on campus this semester?,List all the extracurricular activities you plan on being involved in during this semester. Please include estimated time commitment per week.,Why are you interested in joining SCOPE Consulting? (100 - 200 words),"What skills, expertise and knowledge will you bring to SCOPE Consulting and your team?",What do you hope to gain from this experience?,How did you hear about us? (Check all that apply; if you heard from a friend please check other and enter their name),Is there anything else you would like SCOPE board to know?,Unnamed: 7
,,,,,,,,,,,,,,,,,
8/25/2023 9:44:15,,,Sophomore,May 2026,Industrial Engineering,,No,Yes,Yes,Yes,"ENGR 131 - Peer teacher - 6 hours
Autonomous Robotics Club - Treasurer - 3-4 hours","I am deeply enthusiastic about the opportunity to become a part of SCOPE Consulting. After exploring the company's website and understanding its values and projects, I am convinced that my background and aspirations align perfectly with your organization.

SCOPE Consulting's commitment to delivering innovative solutions and its focus on collaboration resonates with my own values. I am dedicated to academic excellence and problem-solving – qualities that are evident in SCOPE's projects.

What particularly excites me is SCOPE's emphasis on leadership, as demonstrated in my role as Vice President of Entrepreneurs at Purdue. Coordinating productive meetings and executing successful marketing strategies, I've honed skills that would contribute to SCOPE's dynamic environment.


","
I will bring a well-rounded set of skills, expertise, and knowledge to SCOPE Consulting and the team, making a meaningful contribution to your projects and collaborative efforts.


Analytical Thinking: My experience as a Business Development Intern at Halliburton, where I conducted in-depth financial analysis, has honed my ability to dissect intricate problems and make informed decisions. This analytical mindset will contribute to sound problem-solving within the team.

Project Management: Having coordinated as the Vice President of Entrepreneurs at Purdue, I have developed project management skills that ensure efficient task execution, clear communication, and successful outcomes. This expertise is essential for meeting project deadlines and milestones.

Collaborative Approach: My track record of fostering inclusive environments as a leader and collaborating effectively in diverse teams demonstrates my commitment to teamwork. I believe in leveraging collective strengths to achieve optimal solutions.

Research Acumen: My role as an Undergraduate Research Assistant in the SARMAD Lab has equipped me with the ability to conduct thorough research, formulate hypotheses, and draw evidence-based conclusions. This research acumen can contribute to data-driven decision-making within SCOPE Consulting.

Innovative Mindset: As an innovative thinker, I am eager to explore creative solutions to intricate problems. This mindset aligns well with SCOPE's drive for innovative consulting approaches that deliver impactful results.


Language Proficiency: With fluency in Azerbaijani, advanced English, Turkish, intermediate German, and elementary Russian, I can engage effectively with diverse clients and team members from around the world.

Adaptability: My experience in diverse roles, from manufacturing engineering to business development, showcases my adaptability to different contexts. This adaptability will be instrumental in thriving within SCOPE's varied projects.

","
From this experience at SCOPE Consulting, I aspire to achieve both personal and professional growth that will shape my career trajectory and contribute to SCOPE's success. I aim to enhance my practical skills in consulting, project management, and data analysis. Working on real-world projects alongside experienced professionals will provide me with insights into industry best practices, client interaction, and problem-solving strategies.Being a part of SCOPE will grant me a front-row seat to witnessing the inner workings of a consulting firm. I aim to gain a deep understanding of how consulting contributes to business growth, strategy development, and decision-making.",Email,"Overall, my goal is to leverage this experience to become a well-rounded consultant, equipped with practical skills, strategic thinking, and a deep understanding of client needs. I am excited to embark on this journey with SCOPE Consulting and am committed to making the most of this opportunity for growth and learning.",
2023/08/22 8:40:54 PM AST,,,Sophomore,26-May,Industrial Engineering,,,Yes,No,Yes,"Purdue Outing Club - 1 hr per week, Flight Team 3 hrs per week, Tutoring - 2 hrs per week","I have participated in case studies in the past and really enjoy them. I am also considering a career in consulting and would like to learn more about what it would be like. I am also excited to work with local businesses in the West Lafayette community and help make a difference. I feel that the SCOPE members are very supportive and would help me grow personally and professionally. While I am majoring in industrial engineering, I am interested in a business-oriented career, and I think SCOPE can help me explore the world of consulting. I also enjoy working with teams and would like to be a part of a collaborative and productive environment.","I bring several different skillsets to SCOPE. I participated in a competitive case study club in the past and have experience coming up with creative solutions and pitching my ideas to business professionals. This semester, I am also participating in the Student Managed Venture Fund course in which I work to research potential companies to invest in. I am also comfortable working in diverse team environments. This summer, I conducted research in Kenya where I worked with students and teachers from a technical school there along with professors and students from Purdue. That experience strengthened my collaboration skills, especially with people from different backgrounds. I feel that I possess many of the necessary skills to be successful as a SCOPE consultant both professionally and collaboratively.","This experience would help me with both my professional and personal goals. Professionally, I am excited to work with local businesses, have access to career fairs and professional development events, and see what consulting is like. I think that SCOPE will help me develop my professional interests and meet people with similar goals to me. From a personal standpoint, I am looking to meet new people on campus who are motivated and fun to work with. I am excited to be a part of another diverse group of hard-working individuals, and I think that the social events will also be an exciting way to have fun.",Email;Rhea,"I understand that interviews will be Monday and Tuesday of next week and timeslots are randomly assigned. If possible, I would prefer a Tuesday timeslot as I have a few other commitments on Monday during the interview time.",
2023/08/19 3:54:39 AM AST,,,Junior,25-May,Economics,Music Technology,I have not! :),Yes,No,Maybe,"Audio engineering consulting - 4 hours 
 Part time job - 20 hours 
 Production consulting - 6 hours 
 clubs/misc - 3 hours","This is super interesting! :) I love the idea of a student-run nonprofit providing services to small and large business alike. I know this will bring extremely unique experiences and work-case scenarios I may not get in a traditional work setting, and i'm excited to meet like-minded people who enjoy studying and improving themselves and the business around them.","As an economics student studying the intersection of numerous industries like music, agricultural sourcing and copyright law, I feel I could bring different perspectives to the table. I'm a proactive team member and avid listener.","I hope to meet a diverse group of people and tackle tasks in a team setting, leaving with new perspectives of my own!",Email,Keep it up!,
2023/08/23 1:55:44 PM AST,,,Freshman,27-May,Computer science,,No,Yes,Yes,Yes,Other clubs - 10,"I have always been passionate about creating a meaningful impact on the world, and the realm of computer science has granted me the tools to develop solutions that make a tangible difference in people's lives. During high school, I realized my passion for economics revealing the potential that lies in consultingâ€”a path that harmoniously blends my passion for both CS and Economics. My ambition is to bring about a revolutionary change by crafting solutions that are not only technically sound but also economically viable.
 
 I aspire to join SCOPE Consulting as it offers a platform to delve into the consulting field, enrich my understanding of business and economics, and further hone my technological skill set. I eagerly anticipate the opportunity to collaborate with fellow members, exchanging knowledge and collectively expanding our expertise.","My coding journey commenced at the age of 11 and has since grown into a profound passion, leading me through a diverse array of experiences that have enriched my skill set. As a result, I offer a substantial collection of skills, expertise, and knowledge that would greatly benefit SCOPE Consulting and its team.
 In the realm of technical proficiency, I have amassed a wealth of experience through engagement in numerous hackathons, the creation of personal projects, and my involvement in professional app development. My expertise extends to crafting web apps using NodeJS and ExpressJS, as well as creating cross-platform mobile applications using Flutter. In addition, my mastery of Python, honed over a span of 4+ years, equips me to tackle a wide spectrum of challenges. 
 
 My achievements and leadership roles have further refined my abilities. As a national finalist at the esteemed Toyota Hackathon held at IIT-Delhi, I have demonstrated my aptitude for thriving in competitive technical environments. My role as President of the school's tech club exemplified my leadership capabilities, guiding the team to secure more than 150 awards and 6 overall trophies in more than 15 events. I was also the lead student organizer of Robotronics, an inter-school tech symposium that saw over 500 participants from 30+ schools. I was responsible for coordination among all stakeholders, communication between the host school and participants, and ensuring an overall smooth functioning of the event. A passion for sustainability has guided my endeavors as well. Through a data analytics project focused on electricity consumption at my school, I conducted a comprehensive analysis spanning consumption from both fossil fuels and renewable sources. The project further encompassed an assessment of the impact of solar panels, energy-saving initiatives, and LED installations. This initiative garnered recognition through a certificate of merit bestowed by the Honourable President of India, Smt Droupadi Murmu.
 
 My affinity for debating culminated in my achievement as a national semifinalist at Mahabehes '21, the largest student debating championship in India. This proficiency, coupled with my fervent interest in economics and business, propels my aspiration to seamlessly integrate these facets with the world of consulting.
 Collectively, my technical acumen, leadership prowess, commitment to sustainability, and diverse passions align harmoniously with the values and aspirations of SCOPE Consulting. The prospect of contributing these attributes to the team excites me, promising a mutually enriching collaboration that yields impactful results.","I'm eager to acquire insights into the world of consulting and further develop my expertise in technology and economics. My ambition is to play a meaningful role within the team, making substantial contributions that lead to tangible real-world impact. Moreover, the prospect of engaging with individuals from diverse backgrounds, each offering unique perspectives, fills me with anticipation and enthusiasm.",B-Involved fair,Resume - https://tinyurl.com/myresume05,
8/25/2023 23:59:49,,,Junior,May 2025,Industrial Engineering,,No,Yes,Yes,Yes,"Azerbaijani Student Association (1 hour per week, or less).","I am interested in SCOPE Consulting for its focus on offering real-world consulting experiences in business, engineering, and data analytics. The purpose of this consulting club aligns perfectly with my academic and career aspirations, as I would like to be a consultant in the near future, preferably a Technology Consultant. I am eager to apply the theoretical knowledge I have gained in the last few years, as well as the experience in professionalism from working in a corporate environment this summer at my internship. 
I am passionate about working in a customer-facing setting, and I believe consulting, as well as SCOPE Consulting does just that. I find fulfillment from driving meaningful positive impact to a customer's problem. I am also drawn to the diverse composition of the club's members, coming from various countries and academic backgrounds. Collaborating with such a diverse group presents an exciting opportunity to exchange different perspectives and explore unique solutions. Ultimately, joining SCOPE is an avenue for me to utilize and expand my skills, and make a positive impact on businesses while also forging valuable connections for my career aspirations. ","Aside from my academic background as an Industrial Engineering student at Purdue, I have several experiences in case projects like the Caterpillar Aftermarket Sales Project, where my team and I devised a strategic plan for Caterpillar to increase in sales and minimize its losses in aftermarket. I have also been a Head-Organizer for a European Youth Parliament conference, where I lead my team to carefully curate an entire 3 day conference with 200 participants, which involved finding a venue, negotiating with sponsors, catering, and etc. At my internship with Cummins Inc. this summer, I was also a Project Manager for a volunteer event where I allocated resources and budget for the event. My greatest skills would likely be my aptitude to adapt and learn quickly, and my ability of self-awareness. ","I aim to gain practical experience and enhance my problem-solving skills by working on real-world consulting projects with SCOPE. Collaborating with diverse team members and clients will refine my teamwork, communication, and networking abilities. Moreover, as someone aspiring to become a technology consultant, I am particularly excited about the chance to apply my technical knowledge in a consulting context. Ultimately, I hope to build a strong foundation for a successful career in technology consulting while contributing meaningfully to the club's initiatives.",Email,,
8/25/2023 15:42:02,,,Junior,May 2025,Mechanical Engineering,,No,Yes,No,Yes,Peer Success Coach at the Academic Success Center (5 hrs/wk) Skydiving Club of Purdue (3 hrs/wk) ,"I want to join Scope to be part of an excellent and multidisciplinary team of consultants in College. I believe that providing data-driven solutions to local companies is a tremendous opportunity to combine the concepts learned in class with practical applications. I highly empathize with Scope's mission to support local businesses, as it makes all of us aware that we are part of something bigger. Additionally, my background as a Mechanical engineering student could provide valuable insights and a different perspective when developing solutions. The social aspect is something I look forward to, as I enjoy working in collaboration to pursue a common goal while getting to know all the fantastic people on the team.
Ultimately I am committed to creating positive change through innovative solutions, and being part of Scope would be a fantastic opportunity to contribute to this cause and learn about the consulting world.
","Experience with CAD, Python and C. Experience working at a Startup using the Design Thinking Process.","Experience developing solutions for local businesses and project work, Connecting and collaborating with a diverse group of Students, and professional networking.","Instagram, Email",I am an International Student from Peru,
2023/08/23 8:47:29 PM AST,,,Senior,24-Dec,Business Analytics and Information Management,Certificate of Entrepreneurship and Innovation,Fall 2022 and I think all semesters after that,Yes,No,Yes,"As of now, I haven't made any commitment apart from my 15 credits.","I came to the callouts, this wasn't the first time I came in. I have actually got rejected twice after group interview, but I really have seen the progress scope has made so far, I personally feel that better than other consulting clubs on campus. One reason being is that other clubs have huge communiy and big projects which sometimes don't feel very impactful especially when project manager is doing more than half the work. 
 
 I just had a gilmpse of your yearbook, I loved instagram so good efforts for however is marketing Purdue colors. I saw last year's projects but I have been to previous callouts, what I honestly like is having impactful projects, not like just big 10 companies projects cause startups I feel require more push than an established company.","I am learning skills, expertise and knowledge and would always have something to learn. But based on my academic background and my classes so far, I can tell communication, excel skills for doing basic stats, data analytics not proficient still learning, and I have had previous experience with two consulting clubs on campus so , case solving skills and moresoever collaboration with people.","I really want to learn about real life business world but also how to work effectively in teams and make impact. I want to see how it would feel like working for a company where everyone would be so diverse. I genuinely want to make new friends which stay in-touch after graduation, for me that is a very valuable personal connection to have with someone.",Linkedin;Instagram;Purdue Website,"I am helpful, kind and polite. I am very simple person and a type of personality who would ask questions when necessary, who would talk with people with a smile though obviously personal and deep connections are different, in result of conflicts of opinions, I would like to find a common ground, try to work smoothly without offending anybody's opinions.",
2023/08/23 4:23:29 PM AST,,,Sophomore,26-May,Data Science,Economics,No,Yes,No,Yes,Alpha Kappa Psi,"Among the other consulting clubs at Purdue, I felt as though SCOPE Consulting is a sound fit for what I exactly want to do. I believe that the projects SCOPE tackles is very unique and it shows that many people are progressing and getting rewarded for their efforts so I would like to go down the same line as those successful students.","I have good conversational skills as well as listening skills so I can be able to fully understand and converse with other people. Additionally I have good general knowledge of the topics going around the world so if thereâ€™s any new, i am able to jump on it.",I hope to collaborate with other students on a meaningful project and be able to assist companies in the problems that they are trying to solve and create solutions that are unique compared to normal solutions.,Purdue Website,Nope,
8/25/2023 18:30:18,,,Freshman,May 2027,FYE - Intended Industrial Engineering ,Data Science ,,Yes,No,Yes,"SWE (1-2 hours per week) 
CHAARG (1 hour per week) ","I deeply resonate with SCOPE’s goal to have a positive impact in the community and to make the world a better place. In the past three years, I’ve worked with the Leadership Club at my high school to develop a curriculum surrounding social entrepreneurship and ethical businesses. SCOPE’s mission aligned with values that I feel passionately about, and I want to learn how to translate those values into real-world experiences. Looking at the SCOPE 2023 Yearbook, I enjoyed seeing all kinds of companies, from non-profits to agriculture technology,  that SCOPE Consulting was able to help. Exposure to many different industries is important to me, and I was excited by the variety of businesses that work with SCOPE.  ","In a professional setting, my strengths lie in creativity, determination, and collaboration. From 8th grade to senior year, I have earned over $10,000 in seed funding through various businesses and competitive pitching events with my own entrepreneurial venture, iCane—a groundbreaking smart cane designed to liberate the elderly from the necessity of carrying a phone for their safety. In creating iCane, I had to push myself to be innovative and constantly change my game plan the more I learned from those around me. I learned to lean in and contact experts in my field for help, leading me to do research with nursing homes and collaborate with other students to learn more about IoT devices. Being an entrepreneur has also helped me develop my people skills significantly, which have helped me gain more experiences, such as my internship with a healthcare startup based in Chicago, the co-president of my school’s business club, and accolades from the Illinois Manufacturing Association. Regarding technical skills, I have taken courses in Microsoft Excel, Python, Machine Learning, and Java. My unique experiences and ability to connect with others would make me a great addition to the SCOPE consulting team. ","As someone currently trying to create their own company that is making the world a better place, I would learn a lot from helping companies with similar goals and missions as my own thrive in West Lafayette. I want to better understand what goes into developing successful businesses that put ethics and social entrepreneurial values at the forefront of their missions. As I become more experienced, whether through competitions or through working with companies, I want to apply what I have learned to make a real impact in the communities that I am a part of or that need significant help. ","Linkedin, Instagram, Purdue Website","For more information about me, please take a look at my Linkedin!  https://www.linkedin.com/in/umika-arora",
2023/08/19 1:42:39 PM AST,,,Freshman,23-May,Econ/finance,,No,Yes,No,Yes,"Finance, econ, real estate 3 hours",To advance my career and meet new people,Investing,New relationships and skills,Purdue Website,,
2023/08/18 4:51:16 PM AST,,,Junior,25-May,Mechanical Engineering Technology,,No,Yes,Maybe,Yes,"Purdue Baja Racing (SAE) - 2 hours
 Purdue Outing Club - 1 hour (maybe less)","I am deeply intrigued by the transformative impact Scope Consulting offers. Their dedication to blending diverse expertise with real-world challenges resonates with my aspiration to learn and contribute meaningfully. The opportunity to collaborate on strategy, engineering, optimization, and data analytics projects, while assisting businesses, non-profits, and student organizations, is both inspiring and fulfilling. I am drawn to Scope's commitment to nurturing tomorrow's leaders through hands-on consulting experience, which aligns seamlessly with my goal of gaining practical skills and making a positive impact. Joining Scope Consulting would not only facilitate my personal growth but also allow me to be part of a dynamic team shaping tangible solutions and creating lasting change.","bring a versatile skill set to Scope Consulting. With a background in MET, I offer strong analytical abilities for data-driven insights. My experience in MET hones my strategic thinking and project management. I excel in cross-functional collaboration and clear communication. These skills, combined with a commitment to ongoing learning, enable me to enhance Scope's consulting capabilities effectively.","From this experience with Scope Consulting, I hope to gain invaluable hands-on exposure to real-world challenges across diverse sectors. Working on a variety of projects, I aim to refine my problem-solving and strategic thinking skills while learning to tailor solutions to specific client needs. Collaborating within a dynamic team, I aspire to enhance my communication and project management abilities, preparing me for future leadership roles. Additionally, engaging with businesses, non-profits, and student organizations will deepen my understanding of their unique dynamics. Ultimately, I seek to absorb practical insights, build a strong professional network, and contribute meaningfully to Scope's mission while fostering my personal and career growth.",Instagram;Purdue Website,,
